{
  "name": "Stranded Hikers",
  "briefing": "Six hikers are cut off on a forested ridge with a fire climbing toward them. Fly them to the trailhead (green circle). Ground crews are limited; the helicopter is your rescue asset first and a water drop second.",
  "notes": "Authored by tools/author_missions.py (stranded_hikers). Re-run it after changing the rules.",
  "seed": 21,
  "width": 864,
  "height": 648,
  "moisture": 0.14,
  "wind": {
    "speed": 4,
    "bearing": 20,
    "variable": true
  },
  "terrain": {
    "mode": "world",
    "params": {
      "water_level": 0.22,
      "shrub_level": 0.4,
      "forest_level": 0.48,
      "dense_level": 0.64,
      "feature_cells": 100,
      "highways": 1,
      "spurs": 3,
      "towns": 0,
      "ranches": 3,
      "relief": 260
    }
  },
  "elevation": {
    "mode": "world"
  },
  "airbase": [
    6,
    640
  ],
  "staging": [
    658,
    635
  ],
  "safe_zone": [
    656,
    635,
    12
  ],
  "budget": 9000,
  "available_units": [
    "HELICOPTER",
    "HOSE_TEAM",
    "CUT_TEAM",
    "HOTSHOTS",
    "SMOKEJUMPERS"
  ],
  "duration": 2700,
  "objectives": {
    "rescue_all_civilians": true,
    "max_civilians_lost": 0,
    "win_on_contained": false
  },
  "events": [
    {
      "at": 400,
      "wind": {
        "speed": 8
      },
      "message": "Afternoon winds picking up"
    }
  ],
  "ignitions": [
    {
      "x": 672,
      "y": 232,
      "radius": 1
    }
  ],
  "units": [
    {
      "type": "CIVILIAN",
      "x": 650,
      "y": 90
    },
    {
      "type": "CIVILIAN",
      "x": 716,
      "y": 136
    },
    {
      "type": "CIVILIAN",
      "x": 677,
      "y": 98
    },
    {
      "type": "CIVILIAN",
      "x": 663,
      "y": 119
    },
    {
      "type": "CIVILIAN",
      "x": 752,
      "y": 105
    },
    {
      "type": "CIVILIAN",
      "x": 680,
      "y": 129
    }
  ]
}
